{
  "$schema": "dep://schema/envelope",
  "id": "dep://example/envelope/la-001",
  "version": "0.1.0",
  "resource": {
    "type": "link-assertion",
    "id": "la-001",
    "provider_id": "provider:resolver"
  },
  "provenance": {
    "collected_at": "2026-07-01T18:00:00Z"
  },
  "digest": {
    "algorithm": "sha256",
    "value": "sha256:2pkgW3ACR5DHCV090yLMtHvxLIfPL4EGc4jKezUgzPw"
  }
}
