{
  "$schema": "dep://schema/envelope",
  "id": "dep://example/envelope/obs-001",
  "version": "0.1.0",
  "resource": {
    "type": "observation",
    "id": "obs-001",
    "provider_id": "provider:x"
  },
  "provenance": {
    "collected_at": "2026-07-01T12:00:00Z",
    "received_at": "2026-07-01T12:05:00Z",
    "source_ref": "source:sdk-1"
  },
  "digest": {
    "algorithm": "sha256",
    "value": "sha256:WQHsxfoz2QtFiyva_WhFT0i5FFGOLgP25KdyprNXwtU"
  }
}
